{
  "$schema": "http://json-schema.org/draft-07/schema#",
  "type": "object",
  "title": "Claude Memory Backup Schema",
  "description": "클로드 메모리 백업 데이터 스키마 정의",
  "required": ["timestamp", "version", "entities", "relations", "metadata"],
  "properties": {
    "timestamp": {
      "type": "string",
      "format": "date-time",
      "description": "백업 생성 시간 (ISO 8601)"
    },
    "version": {
      "type": "string",
      "description": "스키마 버전",
      "pattern": "^\\d+\\.\\d+$"
    },
    "entities": {
      "type": "array",
      "description": "메모리 엔티티 목록",
      "items": {
        "type": "object",
        "required": ["name", "entityType", "observations"],
        "properties": {
          "name": {
            "type": "string",
            "description": "엔티티 이름"
          },
          "entityType": {
            "type": "string", 
            "description": "엔티티 타입"
          },
          "observations": {
            "type": "array",
            "description": "관찰 내용 목록",
            "items": {
              "type": "string"
            }
          }
        }
      }
    },
    "relations": {
      "type": "array",
      "description": "엔티티 간 관계 목록",
      "items": {
        "type": "object",
        "required": ["from", "to", "relationType"],
        "properties": {
          "from": {
            "type": "string",
            "description": "관계 시작 엔티티"
          },
          "to": {
            "type": "string",
            "description": "관계 종료 엔티티"
          },
          "relationType": {
            "type": "string",
            "description": "관계 타입"
          }
        }
      }
    },
    "metadata": {
      "type": "object",
      "description": "백업 메타데이터",
      "required": ["entityCount", "relationCount", "extractedBy"],
      "properties": {
        "entityCount": {
          "type": "integer",
          "minimum": 0,
          "description": "총 엔티티 개수"
        },
        "relationCount": {
          "type": "integer", 
          "minimum": 0,
          "description": "총 관계 개수"
        },
        "extractedBy": {
          "type": "string",
          "description": "백업 시스템 이름"
        }
      }
    },
    "backupInfo": {
      "type": "object",
      "description": "백업 파일 정보 (옵션)",
      "properties": {
        "filename": {
          "type": "string",
          "description": "백업 파일명"
        },
        "filepath": {
          "type": "string",
          "description": "백업 파일 경로"
        },
        "createdAt": {
          "type": "string",
          "format": "date-time",
          "description": "파일 생성 시간"
        },
        "systemInfo": {
          "type": "object",
          "description": "시스템 정보"
        }
      }
    }
  }
}